{
 "schema_version": 1,
 "id": "A1",
 "finding_ids": [
  "F1"
 ],
 "level": "scene",
 "round": 2,
 "what": "Decide whether the boy's first line should come earlier.",
 "why": "The scene's tension rises only once he speaks.",
 "where": {
  "anchor": "c01.s1.p3",
  "chapter": "Chapter I",
  "page": 5,
  "first_words": "Se puso el sol.",
  "last_words": "en su camino"
 },
 "options": [
  "Keep as is",
  "Move the dialogue up",
  "Cut the description before it"
 ],
 "status": "pending"
}
